TicketId,Text
989,سلام در تمرین اول بخش 0902 شکل مربوط به سؤال فراموش شده است.  - تمرین اول: در شکل زیر دسته‌بندی سلسله مراتبی و افرازی را مشخص کنید؟و مثالی عملی برای هر یک بیاورید. ولی شکلی وجود ندارد
989,سلام بعد از این که شما شکل تمرین یک جلسه 0902 را در فایل آن قرار دادید من آن را انجام دادم ولی اگر آپلود کنم امتیازم از 5 به 3 تغییر می کند. فایل را برای شما می فرستم تا اگر می توانید شما جوری آپدیت کنید که امتیاز من کم نشود چون من مقصر نبودم.
989,فایل کامل تمرین
989,"سلام، در سؤالات های ریاضیات پایه در هوش مصنوعی (1) قسمت 4، اولین تست اشکال دارد. حتی اگر متن تست را در یک ادیتور دیگر کپی کنیم، همه گزینه های آن درست هستند. لطفاً نمره مربوط به آن باید برای کسانی مثل من که 4 از 6 شده اند اصلاح شود.  فرض کنید A, B, C سه بردار غیر صفر و m یک مقدار غیرصفر می‌باشند. در این صورت کدام عبارت صحیح نمی‌باشد؟ A+B = B+A A.B = B.A (A+B)+C = (C+B)+A (A+B)m = mA + mB"
989,میشه لطفاً تصویر سؤالات را دوباره اینجا بفرستید؟ چون من که دیگر دسترسی ندارم.
989,"سلام، من تصویر اصلاح شده سؤال را خدمت شما ارسال می کنم. میشه لطفاً توضیح بدیدکه کدام گرینه نادرسته تا من یاد بگیرم؟"
989,تصویر سؤال
989,"سلام، متشکرم که بالاخره قبول کردید که اشتباه کرده اید. من دوباره شرکت کردم و همه 6 امتیاز را گرفتم."
990,"سلام و عرض ادب                                                                                                                           ببخشید در جلسه نهم  یادگیری بدون نظارت قست دوم  ،، در تمرین اول این بخش گفته شده که "" با توجه به شکل زیر دسته بندی سلسه مراتبی و افرازی را مشخص کنید "" و حتی در فایل ورد این تمرین هم هیچ تصویری وجود نداشت ممنون میشم که اگر تصویر ی برای این بخش  وجود داره اون رو برای ما مشخص کنید سپاسگزارم "
990,سلام خیلی ممنونم از شما فایل الان درست شد ❤️❤️
991,سلام برای من آزمون خود ارزیابی عیرفعال است چگونه می‌توانم آن را انجام دهم 
992,سلام من شروع تازه شروع کردم قسمت اول رو و به پایانش رفتم و نمیدونستم که سوال میپرسه و بهم نمره نمیده ممنون میشم که اصلاح کنید
992,ممنون میشم دوباره فعال کنید برای ویدیو دوم چون داشت حل میکردم مثل اینکه شما پاسخدهی مجدد رو زدید من از ویدیو دوم پرت شدم بیرون و سوالم از دست رفت ممنون از شما
992,ممنون میشم دوباره فعال کنید برای ویدیو دوم و قسمت 1 پایتون چون داشت حل میکردم مثل اینکه شما پاسخدهی مجدد رو زدید من از ویدیو دوم پرت شدم بیرون و سوالم از دست رفت ممنون از شما متاسفانه برنامه شما باگ هایی دارد
993,سلام من شروع تازه شروع کردم قسمت اول رو و به پایانش رفتم و نمیدونستم که سوال میپرسه و بهم نمره نمیده ممنون میشم که اصلاح کنید
993,سلام م میخوام بدونم در قسمت 3 پایتون 1   چه سوال را غلط زدم
994,سلام تمرین اول قسمت دوم یادگیری بدون نظارت شکلش چیه
994,دو گزینه`نام هر ستون می تواند هم در ردیف اول و هم سایر ردیف ها باشد`
994,و `ستون می تواند باشد و یا نباشد`(انتخاب من)
994,در سؤال اول `کدام گزینه درباره‌ی دیتا فریم غلط است؟`
994,قسمت سوم مدیریت فایل و کتابخانه پانداس 
994,با توجه به صحبت های مدرس و تجربه های قبلی خودم غلط است 
994,لطفاً اصلاح کنید و نمره را به من بدهید 
995,سلام میشه بگین محور های رقابتی مسابقه ای که در آینده برگزار میشه چیه؟
996,سلام خسته نباشید زینب شیرین هستم من در حال دیدن قسمت ۲ معرفی هوش مصنوعی بودم و هنوز به یک سوالش پاسخ داده بودم از سایت خارج شدم و دوباره برای دیدن ادامه اون قسمت وارد سایت شدم و دیدم امتیاز شو به من داده در حالی که من دو سوال قبلی رو هنوز پاسخ نداده بودم میشه بهم فرصت شو بدید حداقل فیلم رو تا انتها تماشا کنم و بتونم به دو سوال باقی مونده جواب بدم
997,سلام من اصلا برام پی دی اف تمرین ها باز نمیشه و اصلا نمیدونم چجوری باید بارگزاری کنم تمرینم رو لطفا کمکم کنی چجوری؟ 
998,سلام و ارز ادب خدمت شما برای بارگذاری تمرین باید کد و اسممان رو در داخل فایل بگذلریم یا اسم فایل 
999,سلام ببخشید چرا نمی‌شود فیلم ها رو دانلود کرد؟ لطفا قابلیت دانلود رو هم بزارید
1000,سلام من فایل تکالیف را با فرمت pdf  ثبت کردم ولی الان نمیتونم در سایت بارگذاری کنم  زمانی که روی دکستاپ میرم هست ولی زمانی که روی سایت میخوام پیدا کنم روی دکستاپ همچین چیزی نیست   الان من باید چیکار کنم ؟؟
1000,میشه سریع جواب بدید ؟
1000,?????????
1000,سلام این نمونه فایل 👆👆
1000,یعنی الان من محتوا جلسه 2 رو نگاه کنم . امتیاز تکالیف جلسه 1 از 5 به 3 کاهش پیدا میکند ؟؟
1000,و اطلاعیه ها شماره ندارد فقط تاریخ دارد ؟
1000,و یه سوال دیگه من الان در ورد پاسخ ها را بنویسم و با فرمت پی دی اف سیو کنم منظورتون هست  ( تا الان هم همین کار را انجام میدادم تو نمونه هست نگاه کنید )
1000,اها من در 
1000,گروه شاد عضو نیستم
1000,پس چرا موقع بارگذاری فایل ها را در حافظه دکستاپ پیدا نمیکنم و نمیاد . نمیشه با فرمت دیگه ای بفرستم ؟؟
1000, میشه بگید چه جوری ارسال کنم شاید مشکل از ارسال است 
1000,سلام درست شد خیلی ممنون بابت پشتیبانی 🙏🙏🙏🙏
1001,سلام خسته نباشید زینب شیرین هستم من در حال دیدن قسمت ۲ معرفی هوش مصنوعی بودم و هنوز به یک سوالش پاسخ داده بودم از سایت خارج شدم و دوباره برای دیدن ادامه اون قسمت وارد سایت شدم و دیدم امتیاز شو به من داده در حالی که من دو سوال بعدی  رو هنوز پاسخ نداده بودم میشه بهم فرصت شو بدید حداقل فیلم رو تا انتها تماشا کنم و بتونم به دو سوال باقی مونده جواب بدم حتی در قسمت کلان چالش ها قسمت اول وقتی به قسمت سوال می رسید سوالش رو برام پخش نمیکرد در اینجا در ساعت ۱۹ و ۶ دقیقه اذان میگن من فقط اینترنت تبلتم رو خاموش کردم و رفتم نماز بخونم حتی از سایت هم خارج نشدم بعد از نماز دیدم امتیاز صفر رو بهم داده و مرحله ی بعدیش رو برام باز کرده لطفا پیگیری کنید
1001,سلام و خسته نباشید من میخوام جواب تمرین هامو ارسال کنم اما نمی دونم چه جوری در کانال  کی برد در شاد نوشته که در سایت فیلم های آموزش انها قرار داده شده از صبح دارم دنبال اون فیلم ها میگردم ولی جز تیکت زدن فیلم دیگه ای وجود نداشت لطفا راهنمایی کنید تا بیشتر از این امتیاز از دست ندم
1001,؟؟؟؟؟ 
1001,خیلی ممنونم از پاسخگویی شما
1001,سلام و خسته نباشید در تاریخ ۸ مرداد من از ۸ و ۷ دقیقه قبل ساعت ۱۸ اومد پای برنامه شاد که بتونم لایو کی برد در رابطه با برنامه های شما در این رویداد تماشا کنم که متاسفانه با مقداری تاخیر شروع شد و من باید در ساعت ۶ و۴۵ به کلاس زبان می رفتم و نتونستم لایو را تماشا کنم اگه میشه در رابطه با برنامه های این رویداد که در لایو گفته شد به صورت خلاصه برام بیان کنید با تشکر 
1001,خیلی ممنون
1001,سلام ببخشید خیلی مزاحم تون میشم 
1001,سلام ببخشید مگه جواب هر تمرینی که در عرض یه هفته بدیم امتیاز ۵ ر دریافت نمی کنیم؟ قمست ۴ کلان چالش ها و هوش مصنوعی را من در همین هفته تماشا کردم و تا قبل از آغاز روز شنبه براتون ارسال کردم ولی امتیاز ۳ را دریافت کردم لطفا پیگیری کنید 
1001,سلام و خسته نباشید من وقتی میخوام براتون فایل پایتونی ارسال کنم اون رو به zip تبدیل می کنم داخل کامپیتور فایل پایتونی برای من کد ها رو دقیق و درست اجرا می کنه اما وقتی بهzip تبدیل می کنم و براتون ارسال می کنم و برای اطمینان از داخل سایت دوباره فایل رو ذخیره میکنم که ببینم درست کار میکنه یا نه در موقع اجرا کد میگه [Errno 2] No such file or directory
1001,میخوام بگم که این مشکل از چیه و خدایی نکرده اگه فایل چنین خطایی داد به این منظور نیست که من براتون فایل مشکل دار فرستادم اگه میشه راهنماییم کنید 
1002,سلام و خدا قوت به مسئولین مسابقه کی برد  نحوه امتیاز دهی در مسابقه کی برد گونه است؟ چگونه میتوانم آزمون فاز یک رو بدهم ؟ لطفاً پاسخ گوی سوالات من باشید 🙏🏻 
1003,نحوه امتیاز دهی مرحله ها چیه؟
1003,ببخشید چرا همه ی تمرین های من 3 امتیاز است؟
1004,"سلام وقتتون بخیر مهلت ارسال تمرین «یادگیری بدون نظارت قسمت1-2-3-4»، تا 5 مرداد ماه امسال هست. در صورتی که فیلم آموزشی این تمرین جز فیلم های آخر دوره ست. لطفا پیگیری بفرمایید"
1004,سلام وقتتون بخیر بنده در مرحله پایتون قسمت یک برای حل تمرین چطوری فایل رو تبدیل به پی دی اف کنم که در سایت بارگزاری شود؟
1004,سلام ببخشید بنده در برنامه ویسکود مثلث انتقال برای بنده نمیاد چه کار کنم؟
1005,سلام خسته نباشید من احساس میکنم توی برنامه نویسی دوره ضعیف هستم به نظرتون چه کاری میتونم انجام بدم که خودمو توی برنامه نویسی تقویت کنم ؟ ممنون میشم راهنمایم کنید 🙏 
1005,بله چشم ممنونم🙏🌹
1006,سلام. من وقتی برنامه ماشین حساب رو مینویسم با این خطا مواجه میشم  هر کاری هم میکنم نمی تونم مشکلش رو حل کنم. لطفا راهنمایی کنید (متن پیام خطا داخل فیلمی که ارسال شده مشخص است)
1006,این عکس مربوط به کد هایی است که نوشته ام
1006,و این عکس مربوط به خطایی که با آن مواجه میشوم است ( تمام خطا ها مربوط به یک برنامه هستند )
1006,🙏
1007,سلام خسته نباشید میگم پایان دوره مثلا میتونیم چه پروژه هایی رو بزنیم؟ در این حد میتونه باشه که مثلا یه چت بات توی یه موضوعی باشه؟ و اینکه دوستم جنگو کار میکنه میشه مثلا روی سایتش مدلمون رو پیاده کنیم؟
1007,و اینکه آیا یه لیستی از محتوای کلی دوره دارید؟
1007,یعنی مثلا این سر فصل محتوای هر هفته چیه؟ چون من تا matplotlib  تقریبا دوره رو بلدم میخوام بدونم از کی دیگه محتوای جدید رو میتونم یاد بگیرم البته الان هم داره برام مرور میشه مطالب دمتون هم گرم
1007,سلام یه سوال توی تمرین 2 جلسه 12 باید نمودار رو 3 بعدی رسم کنیم یعنی مثل شکل بالا؟
1007,و اینکه یه سوال دیگه مطمئنید همه جواب های قسمت 4 جلسه 12 درسته؟ چون من مطمئن بودم همش درسته ولی یکشیش غلط بود انگار مخصوصا سوال 1 اش
1007,سلام مجدد این سوال سوم قسمت 1 جلسه 13 خیلی بد نوشته شده بود چون گفته بود آرایه A 2 * 3 هست و B 3 * 2 و من همین رو توی arange نوشتم ولی جواب های دوم و سوم ام میشد یه آرایه 2*2   نتیجه میشه گزینه 1 ولی جواب درست گزینه 4 بود اگه میشه یه بار دیگه واسم فیلم رو فعال کنید 
1007,جدیدا این سوالات خیلی داره اذیت میکنه مخصوصا سوالات این قسمت مثلا طبق فیلم دیدم جواب سوالات میشه فلان حتی از هوش مصنوعی هم پرسیدم ولی یهو میبینم میزنه یه غلط داری یا توی این قسمت آخر اومدم فیلم رو دیدم اما برای این که ریسکش کمتر بشه زدم نمیخوام فیلم رو ببینم و سوالات رو جواب دادم بعد گفت زیر 50 درد میشی زدم که دوباره بدون اینکه فیلم رو ببینم سوالات رو جواب بدم دیدم جوابای قبلی برام ثبت شد و زد 2 امتیاز از 6 امتیاز گرفتی : (
1007,همچنین تمرین 2 جلسه 13 عکسی داخلش نیست!
1007,سلام علیکم خدا قوت یه سوال داشتم یه سایتی هست به نام کوئرا شاید بشناسید من حالا یه دوره یه رایگانی میتونم از این سایت بگیرم از بین دوره هاش بین یادگیری ماشین و یادگیری عمیق بنظرتون کدوم بهتره و با توجه به اینکه توی مسابقه نهایی و در کل یادگیری ماشین بیشتر بدرد میخوره یا یادگیری عمیق؟ حالا طبق تجربه ای که شما دارید ممنون میشم راهنمایی ام کنید
1007,همچنین چند تا سوال دیگه در مورد چالش 1 قسمت 4-4 منظورتون از ویژگی های همون قد و وزن و سن هست دیگه ؟ چون بقیه ویژگی ها مقدار دسته بندی دارند و نمیشه واسشون نمودار دسته بندی و جعبه ای کشید همچنین این ویژگی ها برای سوال های 5 تا 7 همین به همین شکله؟ و یک سوال دیگه اینکه برای پیاده سازی اون تابعی که باید بگه احتمال مدال آوری چقدره من اومدم از کسایی که مدال گرفتن و از ویژگی هاشون با توجه به اون ورزش میانگین گرفتم با درصد گرفتن یعنی اینکه این ورزشکار چند درصد از ویژگی هاش به اون میانگینه نزدیگه اومدم درصد رو مشخص کردم آیا راه حل ام درست بوده؟ در کل خوب بوده یا نه
1007,خیلی ممنون فقط یه سوال دیگه برای پیاده سازی این تابعه اینکه گفتید بیاید با if else یه قوانینی رو پیدا کنید میگم چون توی هر رشته ورزشی یه قوانین خاصی وجود داره پیدا کردن این قوانین خیلی سخت و زمان بر میشه و شاید اونقدر هم خوب کار نکنه. میشه یه راهنمایی کنید که چی کار کنم برای پیاده سازی این تابع؟
1007,در جلسه سوم مقدمه ای بر شبکه های عصبی سوال سومش بنظرم میشه گزینه 2 چون گفته مشکل اساسی مثلا یه مسئله تغیرات یه خونه رو فقط میتونه خطی حل کنه مشکل اساسی هست؟ یا این که فقط مرز تصمیم خطی را می‌تواند ترسیم کند میشه مشکل اساسی اش؟ چون نتونستن مسائل دو کلاسه به بالا شاید نشه مشکل اصلی چون مسئله دو کلاسه هم اگه غیرطی باشه بازم نمیتونه طبق چیز هایی که توی فیلم دیده شد
1007,سلام خدا قوت این الان درصد عملکرد های مدل های منه میخواستم بدونم خوبه یا تا چند درصد افزایش باید بدم تا تقریبا امتیاز خوبی کسب کنم؟ 
1007,سلام مجدد میتونم برای چالش از کتابخونه pytorch و tensorflow استفاده کنم؟
1007,سلام خسته نباشید من الان که بلند شدم دیدم پیام کانال شاد رو گفتم بزار برم یه بار دیگه چک کنم جواب چالش ارسالی ام رو دیدم ای وای کدم سیو نشده بوده و فرستادم و کدم قشنگ نصفه مونده حالا میخوام اگه میشه یه بار کدم رو همین جا بفرستم خیلی واسش وقت گذاشتم.
1007,صبح واسه پشتیبانی غیر آموزشی هم فرستادم ولی گفتند که واسه شما بفرستم
1007,"سلام خدا قوت این تقریبا تمرین قسمت آخر جلسه RNN هست هرچی تلاش کردم تقریبا تمرین رو درست انجام دادم ولی ارور stack expects each tensor to be equal size, but got [1, 64] at entry 0 and [1, 58] at entry 1 رو بهم میده اگه ممکنه مشکلش رو بهم بگید با تشکر"
1007,خب باید چی کار کنم؟
1007,این تمارین قسمت RNN به بعد خیلی داره سخت میشه لطفا سریع تر حل تمرینش رو بزارید
1007,اصلا خود پیدا کردن دیتا ست مشکله چه برسه به ساخت شبکه و آموزش مدلش
1007,بنظرتون چون فاز 2 از یادگیری عمیق استفاده میکنیم به مرور جا میفته مطالب؟
1008,با سلام و عرض ادب ببخشید یه سوال داشتم در امتیاز تمرین ها امتیاز بالا 3 است 
1009,سلام بزرگوار خسته نباشید🌹 خداقوت🌹😊 ببخشید من اشتباهی ثبت کردم آزمون قسمت اول رو ولی سوالات رو ندیدم و جواب ندادم  و ثبت شده چه کار کنم؟
1010,سلام وقت بخیر  من جواب سوال هر ویدیو رو میدم همیشه به من 4 امتیاز میده حتی وقتی که مطمئنم همه شون درسته!!!
1011,"سلام وقت بخیر، چند روز پیش به من پیام داده شد که در بورسیه برگزیده شدم. امروز پیام اومده که این بورسیه شامل متوسطه دوم نمیشه چیکار کنم   در ضمن امتیاز مرحله آزمون رو از کجا ببینم"
1012,سلام یه سوال داشتم ممکنه نصب vs code باعث ویروسی شدن سیستم یا مشکل دیگه ای برای اون بشه؟
1012,سلام وقت بخیر یه سوال داشتم بعد از اتمام آموزش های عمومی بلافاصله آموزش های تخصصی بارگذاری میشه؟
1012,سلام وقت بخیر
1012,"من به خاطر درس و امتحانات از آموزشات عقب افتادم، تقریبا اواخر آموزشهای عمومی، میخواستم اگر میشه راهنماییم کنید چطوری خودمو برسونم، چون نمی‌خوام عقب بمونم ولی خیلی گیج شدم، ممنون میشم راهنماییم کنید"
1012,"یه مدت از آموزشا فاصله گرفتم، از فضا دور افتادم ، به خاطر همین انگار مطالب خیلی جدید گنگ و پیچیده شده برام، ممنون از راهنماییتون"
1012,تشکر
1013,می‌خوام بهترین کس خودم باشم
1014,"سلام وقت بخیر.من بورسیه شدم اما برام پیام اومده بورسیه به متوسطه دوم تعلق نمیگیره همراه کد تخفیف 50 درصد. وارد سایت ارسال شده میشم، وارد اکانتم میشم و وارد صفحه پرداخت نمیشم.هرچند تحت پوشش کمیته امداد هستم و نمیتونم پرداخت کنم. ولی خواستم مطمئن بشم. آخه گفته مهلت ثبت‌نام تا شنبه هست. میشه لطفاً بزارید من بورسیه بمونم؟ "
1015,سلام. لطفا راجع این عکس توضیح بدید ممنون.
1015, این عکس سوال دو یادگیری بدون نظارت است
1015,ممنون
1015,این عکس الان جز کدو دسته است ؟
1015,pca
1015,lda
1015,pca حقه
1015,lda حقه
1015,خیلی ممنون
1016,"سلام وققتون بخیر من این پیام برام ارسال شد  اما من هم داخل مدرسه غیر دولتی نیستم  هم دوره برام باز شده و چند قسمت رو دیدم  دانش‌آموز عزیز طرح بورسیه رویداد هوش‌مصنوعی کی‌بُرد شامل ""مدارس غیردولتی"" نمی‌شود، شما می‌توانید با کد تخفیف 50% و از طریق لینک زیر برای ثبت‌نام اقدام نمائید: https://kibordevents.com/signUp  کد تخفیف: kibordAI-50 مهلت استفاده: شنبه 6 مرداد لغو11 "
1016,ممنون 
1017,سلام وقتتون بخیر ما بایت ایده کارمون به مشکل بر خوردیم و حتما به جواب شما نیاز داریم ببینید ایده ما یک برنامه ورزشی هست که به این صورت کار میکنه که شما حرکت ورزشی رو انجام میدی و اون بررسی میکنه که تو حرکت رو داری درست انجام میدی یا نه حالا این ایده که با پردازش تصویر در حالت لایو هست جز دسته های شما برای مسابقه محسوب میشه یا نه چون ما هیچ شیوه نامه ای نداریم که محدودیت ها و قوانین برنامه های که ما میتونیم لزش استفاده کنیم رو مشخص کنه ممنون میشم که جواب بدین
1018,سلام میشود جواب سوالات یادگیری نظارت شده قسمت1 را بگید تا من ببینم کدوم اشتباه زدم؟
1019,سلام وقتتون بخیر من محمدرضا استادیم که تو دوره قبلی مقام اورد حالا یه سوال داشتم بابت این دوره ایده که من دارم با  پلاگین opencv که برای پردازش تصویر داخل یونیتی قابل اجرا و توسعه خواستم بدونم ما محدودیتی بابت ساخت داریم مثلا میشه از یونیتی استفاده کرد یا نه اگر نه ما باید تو کدوم حوزه یا انجین برنامه رو بسازیم و توسعه بدیم
1020,سلام خسته نباشید ببخشید میخواستم بگم اگه میشه بعد از جواب دادن به سوالات ویدیو معلوم بشه جواب صحیح هر سوال کدام بود
1021,سلام ببخشید من به سوالات جلسه اول پاسخ دادم ولی در آخر آورد به سوالات پاسخ ندادید 
