TicketId,Text
554,سلام من توی جلسه ی 3 پایتون قسمت 3 به مشکل خوردم 
554,وقتی کد ر اجرا میکنم بهم یه لیست از اعداد 100 تا999 رو میده
554,خب راستش من هنوز جلسات رو نگاه نکردم ولی نگاه می کنم ممنون از کمکتون
555,چرا بر چسب زدن میتواند هزینه بر با شد
556,سلام جناب ببخشید در مورد زمان ارسال تمرین ها خواستم بهتون بگم امتحانات من تازه تموم شده و الان نمی تونم تمرینی ارسال بکنم دلیلش چیه؟
557,سلام و وقت به خیر خسته نباشید لطف میکنید سر فصل های دوره رو اعلام کنید چه بخش عمومی چه تخصصی که بدونیم چی در انتظار ما هست؟
557,"منظور بنده این بود که سرفصل های دقیق تر مثل اینکه از مباحث عمومی, مبحث رگرسیون رو داریم یا توی پردازش تصویر شبکه های عصبی کانولوشنی"
557,تشکر از شما
557,سلام و وقت به خیر خسته نباشید برنامه جدیدی که برای کمک به افزایش امتیاز دارید این هست بچه ها با خلاقیتی که دارند یک پروژه برنامه نویسی یا تحقیق و مقاله آماده کنند و برای شما ارسال کنند و داوران به آنها امتیاز بدهند
557,سلام و وقت به خیر خسته نباشید ببخشید امکانش هست یک کم زمان ارسال تمارین را افزایش بدهید چون توی این ایام افراد زیادی به سفر اربعین می‌روند و دسترسی ندارد ممنون میشوم این مورد را بررسی کنید
557,سلام و وقت به خیر خسته نباشید دو تا اکانت رو همزمان نمیشه لاگین داشت هر کدام لاگین کنی از دیگری خارج می‌شود لطف میکنید این مورد را بررسی کنید😢
557,سلام و وقت به خیر خسته نباشید میخواستم ببینم امکان این هست که دلیل ندادن چند امتیاز چالش اول را پرسید تا بدانیم مشکل کجا بوده تا در چالش بعد جبران کنیم؟
557,تشکر
557,سلام و وقت به خیر خسته نباشید لطف میکنید اگر کد های آموزش داده شد را در اختیار دوستان قرار دهید چه از طریق فایل چه گیت هاب و غیره با تشکر
557, سلام و وقت به خیر خسته نباشید روند انتشار ویدئو های آموزشی در ایام امتحانات برقرار است؟ و اینکه اگر بله امکان این موضوع است که برای این مدت این موضوع متوقف بشود؟
558,میشه زودتر اپلود کنید ویدیو هارو؟خیلی وقته نزاشتید
559,"سلام من وارد صفحه می شم ولی هیچی برام فعال نیست، باید چکار کنم؟ "
560,برای من خروجی نمیاد چکارکنم 
560,سلام شما گفته بودید تا اول تیر مهلت ارسال تمرین داریم الان که مهلت همه تموم شده ترو خدا جواب بدید
561,چرا صدا های فیلم های اموزشی نمیاد و همچنين قسمت چهارم کلان چالش ها و هوش مصنوعی بالانمیاد
562,سلام خسته نباشید . من یک مشکلی دارم زمانی که برنامه ای روکه قرار بود دانلود کنیم تا پایتون رو روش اجرا کنیم رو دانلود کردم ولی نصب نشد و نتونستم از اون استفاده کنم .!من یک مدل دیگه میتونم پایتون رو اجرا کنم ولی زمان ارسال تکلیف روی صفحه بار گذاری نمیشد و اینطوری زمان ارسال تکلیف های قسمت پایتون من تموم شد من چی کار کنم ؟؟
562,ممنونم 
563,سلام برنامه پایتون روی کامپیوتر من نصب می شود و باز نمی شود و همش از من می خواهد که نسخه دیگری را نصب کنم ولی برایم باز نمی کند
563,چرا برای هر موضوع فقط یک بار می توانیم سوال کنیم 
563,آیا بعد از تمام شدن فاز یک تمام محتوا های فاز یک پاک میشود؟
564,"سلام من با توجه به پیشنهادها و تعریف هایی که از سایت شما و آموزش های سایتتون شنیده بودم و همچنین پشتیبانی شرکت همراه اول از این دوره، بعد از بررسی های متعدد سایت و دوره ی بازی سازی سال قبل تصمیم گرفتم که توی دوره تون به همراه 2 تا از دوستانم ثبت نام کنم. بعد از ثبت نام و شرکت در آزمون خود ارزیابی، وارد مرحله ویدیو های آموزشی شدم ولی با توجه به سال تحصیلی و ایام امتحان ها و برنامه های فشرده ی مدرسه برای دروس، با در نظر گرفتن مهلت 100 روزه ی دیدن فیلم ها، با دوستانم تصمیم گرفتیم که ویدیوهای دوره را یعد از سال تحصیلی، به صورت فشرده تر و در زمان کمتر مشاهده کنیم و پیش برویم، اما بعد از مدتی که وارد سایت شدیم متوجه این شدیم که ویدیوها تکلیف داشته و تکالیف هم زمان دار هستند و اگر تکلیفی انجام نشود و مهلت آن به اتمام برسد، فیلم بعدی باز نشده و به صورت زنجیره وار فیلم های بعدی بسته شده و دوره اتلاف میشود. وقتی تکلیف فیلم اول بسته شد، بقیه فیلم ها هم بسته شد. نکته مهم تر اینجاست که هیچ جایی نوشته نشده بود که تکلیف ها زمان دار هستند و اگه انجام نشوند نمی توان فیلم بعدی رو دید.  درخواستی که دارم این هستش که لطفا نسبت به اصلاح این مشکل و رویه ی خود اقدام بفرمایید تا بتونیم حداقل از محتوای دوره استفاده کنیم."
564,خیلی ممنون
564,بله حق با شماست من فکر می کردم که محتوا ها بسته شده در صورتی که اینطور نبود و فقط تکالیف بوده
564,سلام. خسته نباشید امکان دیدن جواب سوالات ویدیو بعد از ارسال جواب ها وجود داره؟ ممکنه قرار بدید؟
564,سلام. من اطلاعات رو وارد کردم. فقط شماره دانش آموز رو با شماره والدین یکی وارد کردم. شماره ندارم.
564,سلام. من خیلی وقته هدیه رو تحویل گرفتم ولی وقت نکرده بودم اطلاع بدم. الان از همین طریق اطلاع دادم
564,سلام.  خسته نباشید. می خواستم بدونم قسمت آموزش های عمومی کلا تموم شد؟ یعنی دیگه هیچ ویدیویی نمیذارید در اون قسمت؟ همه ویدیو های جدید توی قسمت آموزش اختصاصی قرار میگیره؟
564,"سلام و خسته نباشید. بعد از اتمام کل رویداد (رویداد هوش مصنوعی)، باز هم امکان مراجعه به سایت و دیدن ویدیو ها هست؟"
565,سلام خسته نباشید ببخشید جلسات حل تمرین رو نمیتونم نگاه کنم لطفاً بررسی کنید 
566,سلام.وقت بخیر. ببخشید پیامک پذیرفته شدن در المپیاد کیبرد دیر برای من ارسال شد و من یک هفته‌است که وارد شدم و زمان ارسال تمام تمارین به پایان رسیده.با توجه به اینکه بخش بزرگی از امتیازات را تمارین ایجاد می کنند من چگونه می توانم تمارین را ارسال کنم؟
567,من همرو رفتم و به سوالاش جواب دادم دلی فقط ۶۰ امتیاز دارم باید چکار کنم الان 
568,سلام خسته نباشید در آخر آموزش آیا میشه هوش مصنوعی ساخت که باهات چت کنه؟ مثل chat gpt. یا فقط پردازش تصویر رو آموزش میدید؟
569,سلام صفحه من دچار مشکل شده و بالا و پایین نمیره و به همین دلیل نمیتونم به محتواهای اموزشی و تمرین هام دسترسی داشته باشم 
569,مدل گوشی هم سامسونگ A02s
569,تنها همین صفحه اول هست و مابقی جلسات نمیاد حتی تمرین ها و قسمت خانه هم همینطور هست
569,درود  فامیلی من بهزادی هست اما به اشتباه بعذادی ثبت شده و من نمیتونم تغییرش بدم لطفا صحیحش کنید
569,"درود من الان قسمت ریاضیات پایه در هوش مصنوعی(۱)قسمت۳هستم اما وقتی فایل تمرین رو دانلود میکنم،فایل تمرین قسمت ۱ جلسه مصور سازی و تحلیل داده دانلود میشه و چند بار امتحان کردم و مدام همین مشکل رو داشتم"
569,درود وقت بخیر من چالش شماره یک رو انجام دادم اما با اینکه توضیحات رو خوندم متوجه نشدم و منظور از notebookچه فایلی هست؟
569,"سلام وقت بخیر، من وقتی به سوالات چهارگزینه ای درون ویدئو ها پاسخ میدم ، جواب درست رو میزنم ولی بعد میبینم یه گزینه دیگه زده شده    مثلا من به این سه سوال درست پاسخ دادم اما دیدم امتیازم صفر رد شده پاسخ چهارگزینه ای هارو که نگاه کردم متوجه شدم گزینه هایی که من زدم ناخواسته عوض شدن و این اتفاق چندین بار برام پیش اومده"
570,سلام روز بخیر جلسات حل تمرین رو نمیتونم نگاه کنم لطفاً بررسی کنید 
570,صفحه برام بالا و پایین نمیشه و مثل قبل شماره گذاری نیست
570,ردمی A2پلاس
570,لطفا سریع تر بررسی شود
570,امکان ارسال پیام ندارم از کافی نت وارد شدم
570,سلام خسته نباشید خدا قوت در نصب برنامه پایتون با موبایل و همچنین لب تاپ دچار مشکل می شوم و سایت داخل ویدیو برام بالا نمیاره چیکار کنم
570,سلام خسته نباشید خدا قوت در نصب برنامه پایتون با موبایل و همچنین لبتاپ درچار مشکل میشوم واصلا اون سایتی که داخل فیلم بود برام بالا نمیاره باید چکار کنم ؟
570,ممنونم
570,سلام خسته نباشید شاید خبر خوبتون اینه که میخوایید از طریق همراه اول بهمون اینترنت رایگان بدید🤭😎
570,شاید هم مربوط به سوالات داخل ویدئو باشه
570,سلام خسته بابت تمدید مهلت ارسال تکالیف من نصف تکالیف رو ویرایش کردم اما هیچ امتیازی دریافت نکردم جریان چیه؟
570,خسته نباشید 
570,سلام روز بخیر من نمیتونم متن رو بخونم و همچنین توضیح پاسخ رو هم نمیتونم بدم چکار باید کرد ؟
570,بله نگاه کردم ولی متن درهم ریخته است
570,میشه معرفی کنید ممنون میشم 
570,الان کاری از دستم برنمیاد؟
570,از همراهی شما سپاسگزارم ❤️
570,سلام خسته نباشید من لپتاب ندارم و نمیتونم پایتون رو نصب کنم خواهشاً نصب پایتون روی گوشی رو آموزش بدید و همینطور فایل پاسخ تمرین برام درهم ریخته است خواهشمندم از آقای دارچینی توضیح بدن ممنون میشم
570,بسیار متشکرم 😍🥰
570,چشم 🥹
571,سلام با عرض پوزش میشه یه راهنمایی کنید..من تازه امروزمتوجه شدم باید ثبت نام کنم. الان خیلی از تمرین هارو از دست دادم و محلتش به اتمام رسیده و اگر اون تمرین هام انجام ندم ویدیو بعد باز نمیشه.. امکانش هست الان تمرین هارو انجام بدم و بفرستم یا راهکار دیگه ایم هست؟ 
572,"سلام، من در یکی از قسمت ها بودم، و سوال اول رو جواب دادم، و وقتی به سوال دوم رسید، سوال ها برام بالا نمیان که بخوام بهشون جواب بدم، چیکار کنم؟؟ "
572,و قسمت جدید برام باز شد با اینکه هنوز اجازه جواب دادن به دو سوال دیگه رو بهم نداده
573,سلام وخسته نباشید من یه سوال داشتم من یه مدتی کی برد را کار نکردم والآن میخواهم برم‌تو‌کی برد نمیشه وقتی ام که میرم تو از یه جایی به بعد پایین نمیره گیر میکنه ممنون میشم راهنمایی کنید امیر مهدی فلاح 
573,سلام‌وقت بخیر هر کاری می کنم نمی توانم صفحه ایی که به ترتیب تاریخ کلاسها بود ببینم 
573,میشه لطف کنید بگید کلاسها از کی دوباره شروع میشه و اینکه صفحه کلاسها چطوری بالا بیارم
574,سلام و درود من برنامه ای نوشتم که دو عدد اعشاری رو می گیره و مجموع اون ها رو محاسبه می کنه.برنامه اجرا میشه اما موقع نمایش پاسخ جواب رو تا 10 رقم اعشار نشون میده در حالی که اعداد ورودی من فقط یک رقم اعشار داشتند و پاسخ هم باید با یک رقم اعشار نمایش داده میشد.علت چیه و چه طور باید کاری کنم که تعداد ارقام اعشار متناسب با اعداد ورودی باشه؟ 
574,من عکس برنامه  ای که نوشته بودم رو ارسال کردم ولی گویا ارسال نشده درسته؟
574,سلام و درود چرا استاد صبحی در جلسه هفتم قسمت پجم ردیف های ماتریس درهم ریختگی را پیش بینی مدل معرفی کردند و ستون های آن را برچسب اصلی...اما استاد حل تمرن بالعکس ردیف ها را برچسب اصلی و ستوان ها را پیش بینی مدل معرفی کردند و حل تمرین جلسه هفتم قسمت پنجم با محتوای تدریس شده از این جهت مغایرت داشت؟!
574,"استاد صبحی در زمان تدریس ردیف ها را به عنوان پیش بینی مدل در نظر گرفتند،ستون ها را به عنوان برچسب اصلی.ولی خود ایشان هم در زمان توضیح تمرین این ردیف و ستون را جا به جا اعلام کردند؟!!!"
574,در این صورت جواب معیارهای ارزیابی مدل در حالتی که ردیف رو پیش بینی مدل در نظر بگیریم با حالتی که ردیف رو برچسب اصلی در نظر بگیریم با هم متفاوت میشن؟!!
574,مگه میشه جواب یک شخص با شخص دیگر متفاوت باشه؟!
574,برای حل تمرین اول قسمت 2 از درس 10 من یک کد ساده نوشتم اما گویا پایتن فایلی که ازش خواستم اوپن کنه رو نمی خونه.ایراد کارم کجاست؟
574,تو این فایل متنی داده ها رو وارد کردم
574,"تو این کد نویسی ساده فقط خواستم امتحان کنم اطلاعات داخل فایل رو می خونه یا نه،اما خروجی رو یک لیست خالی میده؟!"
574,سلام و درود.در جلسه یازدهم قسمت 4 استاد مازوچی در فرمول واریانس و کواریانس مخرج را تعداد کل داده ها منهای یک(n-1) معرفی کردند.اما د رمنابع معرفی شده مخرج این معیارها تعداد کل داده ها می باشد(n). علت این تناقض چیست؟
574,سلام و درود. گویا پاسخ سوال آخر ویدئوی قسمت اول از درس 13 اشتباهی در سیستم گزینه 4 در نظر گرفته شده درحالی که فقط 
574,سلام و درود. گویا پاسخ سوال آخر ویدئوی قسمت اول از درس 13 اشتباهی در سیستم گزینه 4 در نظر گرفته شده درحالی که فقط گزینه 1 صحیح میباشد و مرتبه دو حاصل ضرب دیگر 2 در 2 خواهد بود و نه 3 در 3
574,سوال اول ویدئوی قسمت دوم درس ۱۳ نیز به دلایل زیر به نظر اشتباه است:
574,"هر چهار گزینه به صورت زیر اشتباه هستند:  الف) هر ستون (نه سطر) ماتریس تبدیل خطی، تبدیل یافته‌ی یکی از بردارهای پایه است. ب) در یک تبدیل خطی، مبدأ مختصات جابه‌جا نمی‌شود. ج) ماتریس تبدیل خطی لزوماً مربعی نیست. د) تبدیل خطی لزوماً خروجی ضرب دو ماتریس نیست"
574," ماتریس تبدیل خطی لزوماً مربعی نیست. تنها در صورتی که تعداد ابعاد فضای ورودی و خروجی برابر باشد، ماتریس مربعی خواهد بود. د) تبدیل خطی لزوماً خروجی ضرب دو ماتریس نیست؛ بلکه می‌تواند به‌صورت اعمال یک ماتریس بر یک بردار تعریف شود."
574,سوال اول ویدئوی قسمت دوم جلسه 13 اصلاح شده بود و پاسخ سوالات داده شد.سپاس
574,"اما تا اونجایی که من یادم هست سوال آخر قسمت اول جلسه 13 A=(2,3) , B=(3,2)  بودند که حاصل ضرب A*B یک ماتریس 2در 2 میشد.شاید نگارش سوال طوری بوده که من اشتباه برداشت کردم"
574,سلام و وقت به خیر.برای ارسال پاسخ چالش اول کیبورد عنوان کرده بودید که فایل نوت بوک ارسال بشود.من فقط بلدم فایل نوت بوک رو در گوگل درایو خودم ذخیره بکنم و بعد لینکش رو ارسال کنم.آیا روشی وجود داره که خود فایل رو بشه در سیستم کامپیوتر ذخیره  کرد؟
574,سلام و درود. لطفا یکبار دیگه پاسخ سوالات پرسش های متن ویدئوی قسمت اول از جلسه 15 رو بررسی کنید.به نظرم میاد که همه سوالات رو درست پاسخ داده باشم ولی یکیش رو غلط گرفته.من تقریبا مطمان هستم پاسخ هام درست بوده اند مگر اینکه اشتباهی گزینه ای رو انتخاب کرده باشم
574,منظورم اینه که لطفا بررسی کنید نکنه شما اشتباهی گزینه غلطی رو به عنوان پاسخ درست به سیستم داده باشید.با تشکر
574,وای چه جالب که در نسخه جدید امکان دیدن پاسخ صحیح سوالات چهارگزینه ای داخل متن ویدئو هست و الان با اطمینان می گم سوال آخر چهرگزینه ای در قسمت اول از جلسه 15 پاسخش باید گزینه 3 باشه و نه گزینه 1.شما گزینه 1 رو صحیح در نظر گرفته اید
574,به جز پیام اول مابقی پیام ها رو نادیده بگیرید لطفا.تاره متوجه شدم که خودم با وجودیکه جواب رو بلد بودم و مطمان بودم از درستیش ولی اشتباه انتخاب کرده ام.اصلا نمی دونم چه طور چنین چیزی ممکنه.
574,پیام اول هم همین بود که چه طور میتونم یک فایل نوت بوک رو دانلود کنم؟از گوگل درایو باید دانلودش کرد؟
575,سلام و وقت بخیر.آیا امکان ویرایش پروفایل وجود دارد؟
575,منصوره علی پورشهدادی یازدهم تجربی استان کرمان شهر شهداد
575,آموزش های متوسطه اول با متوسطه دوم تفاوت دارند یا نه؟
575,آموزش های متوسطه اول با متوسطه دوم تفاوت دارند یا نه؟
576,"سلام این یعنی چی  سلام دانش آموز عزیز با توجه به قبولی شما در آزمون بورسیه، چند بار برای ثبت نام رایگان در رویداد کی برد خدمتتون پیامک ارسال شده، برای ثبت اطلاعات اقدام نکردید. B2n.ir/kibordE اعلام مشکل در ثبت نام ارسال ۳۱ نیاز به مشاوره ارسال ۲۵ اعلام انصراف ارسال ۱۸ لغو11"
576,اون داستان نمونه دولتی و اینا چی بود
576,الان اینو قبول شدم یا نه که بتونم برم نمونه دولتی؟
577,سلام سایت برای من مشکل داره  اصلا بالا و پایین نمیره 
578,سلام صفحه من هنگ کرده نمیتونم به آموزش ها دستیابی کنم 
579,سلام ما هنوز فرصت نکردیم که ویدیو ها رو ببینیم درگیر امتحانات بودیم من 3 جلسه بیشتر ندیدم زمان بندی بدی بود  
580,"سلام وقت شما بخیر ، خدا قوت  متاسفانه از همان روز هایی که دوره ی آموزشی شروع شد ، مصادف با روز های آخر مدرسه ما بود و ما روز های آخر تازه درس هامون رو  تمام کردیم و تا آخرین روز ، ما امتحانات مستمر داشتیم . این مسئله باعث شد وقتی برای مشاهده ویدئو  ها و ارسال تمارین نداشته باشم . از اول ماه خرداد من درگیر امتحانات پایان ترم  هستم  که تا ۲۹ خرداد ادامه دارد و اصلا نمی تونم فرصتی برای این دوره های آموزشی بگذارم . لطفا شرایط ما را مدنظر قرار دهید و کمی درک کنید و بعد از امتحانات مهلت ارسال مجدد تمرین ها و مشاهده ی ویدئو  ها را به ما بدهید . خیلی ممنونم   "
580,"سلام وقت شما بخیر،  خیلی متشکرم از پاسخگویی و آموزش های فوق‌العاده شما"
581,باسلام بنده از امروز شروع به انجام فعالیت کردم اما تاریخ پاسخ به تمرینات از خیل قبل پیش هستش یعنی الان نمیتونم جواب بدم؟
582, سلام.خسته نباشید.صفحه نمایش من به طرف پایین نمیره و فقط دوتا فیلم اول رو نشون میده فقط در این برنامه  اینطوره. لطفا راهنمایی  کنید.ممنون
582,سلام مدل گوشیم A12 سامسونگ هست و از گوگل کروم استفاده میکنم 
582,فقط همین صفحه رو میاره پایین تر نمیره
582,خیلی ممنونم🌹🌹
582,سلام وقتتون بخیر شرمنده مزاحم شدم ⚘🙏🙏   ببخشید من وقتی وارد وی اس کد میشم وقتی میخوام کدم رو اجرا کنم و مثلث رو میزنم هیج اتفاقی نمیفته و کدم اجرا نمیشه باید چیکار کنم ؟
582,چشم ممنون 
582,سلام ‌وقتتون بخیر 🌸🌹🌸ببخشید این چند وقت اینترنت خیلی ضعیف بود و هست و من به سختی وارد سایت میشم ونمی تونم فیلم های آموزشی رو ببینم ویا تمرین ها رو ارسال کنم..اگر امکانش هست و صلاح میدونید میشه لطفا فرصت ارسال تمرین ها رو کمی بیشتر کنید ؟🌹💐💐
582,خیلی ممنونم 🌹🌹🌹
582,سلام وقت بخیر خبر خوشحال کننده این هست که قراره از همه آزمون بگیرید و بر اساس اون به امتیازمون اضافه کنید؟
582,سلام خسته نباشید وقت بخیر ⚘🌸ببخشید  فیلم های آموزشی تا کی در اختیارمان هست ؟یعنی مثلا اگه چند سال دیگه وارد سایت بشیم و بخواییم فیلمی رو مرور کنیم می تونیم ؟
