TicketId,Text
1,سلام
1,تست
2,تست
2,dfgdfg
3,تست
6,سلام ببخشید چجوری میشه یه فایل دیگه رو به عنوان تکلیف اپلود کنم
6,باشه ممنون
6,سلام همون طور که میدونید کم کم تایم امتحانات اگه میشه محلت ارسال رو بیشتر کنید
7,سلام ببخشید من یک مشکلی داشتم تمرینات نتونستم ارسال کنم و الان نوشته تمام شده وقت ارسال من باید چیکار بکنم 
8,سلام خسته نباشید؛ آیا تمرینات بخش مربوط به پایتون رو هم باید به شکل pdf ارسال کنیم یا فایل py? اگر باید به شکل pdf ارسال کنیم چطور این کار رو انجام بدیم؟؟؟
9,سلام  تمرین های ما کی تصحیح میشه؟
9,آیا تصحیح شده؟
9,سلام وقت شما بخیر
9,محتوای آموزشی جدید کی آپلود میشه؟پ
9,سلام
9,من چه جایزه ای بردم؟
9,سلام بعد از پایان فاز آموزش عمومی ما باز هم به محتوای آموزشی فاز عمومی دسترسی داریم؟ بعد از پایان فاز آموزش عمومی چه می شود؟
11,سلام وقتتون بخیر. من نتونستم ویدئوی جلسه‌ی دوم رو به موقع ببینم و طبیعتا نتونستم تمارینش رو هم ارسال کنم. الان ویدئوهای دیگه هم برام نمیان و آخرین مهلت ارسال تکلیف تا امروز هست. الان باید چیکار کنم؟ دیگه نمی‌تونم بقیه‌اش رو ببینم؟؟؟
12,"سلام خسته نباشید . بنده این مدت درگیر امتحان های میان ترم بودم و نمیتونستم تکالیف رو ارسال کنم ، الان اومدم و میبینم زمان تکالیف بسته شده ، در حالی که توی کانال روبیکا نوشته شده بود تا 16 اردیبهشت برای جلسه سوم و چهارم وقت هست ، خواهش میکنم وقت اضافه بدین"
12,سللم هر کاری میکنم و در حال دیدن ویدیو هستم تست ها برایم بالا نمیایند ولی مینویسد تست ها را دیدی و نمره صفر به من میدهد در حالی که هیچ تستی راندیدم و هیچ چیز را جواب ندادم و حتی اسکیپ هم نکردم اعصابم سر این سوالات خورد شده چیکار کنم که درست شه این وضعیت ؟؟؟؟؟؟؟؟؟؟؟؟؟؟؟؟؟؟
12,وقتی ویدیو شروع میشه سریع رفرش میشه تست ها که با پوینت زرد اون پایین هستن پاک میشه و امتیازش رد میشه در حالی که حتی ویدیو رو شروع نکرم ....
12,"وای ، دوباره هم همین اتفاق افتاد"
12,چیکار باید کنم
12,"سلام وقتتون بخیر از edge استفاده میکنم ، و اینترنت مخابرات دارم ، بله از یک سیستم استفاده میکنم ، اون مواردی که سوال رو ثبت کردم مجبور شدم بدون دیدن ویدیو بزنم رو گزینه زرد پایینش که میگه به مشاهده نیاز ندارم"
12,"خیلی متشکرم ازتون ، واقعا لطف کردید"
12,"سوالات رو جواب دادم ، فقط جلسه 2 قسمت 3 پایتون باز نمیشه برام"
12,و سوال دیگری که دارم این است از چه مرورگری استفاده کنم که دیگر این اتفاق نیفتد؟
12,یعنی مجبورم بدون دیدن ویدیو به وسالات پاسخ دهم؟
12,"برای قسمت 3 پایتون خواستم این را امتحان کنم ولی دوباره به تست ها جواب نداد ، میترسم در آموزش های فاز بعد هم این اتفاق بیفتد"
12,چیکار کنم که این اتفاق نیفته؟
12,خیلی خیلی متشکرم ازتون🌹
12,"سلام امکانش نیست مهلت تکالیف رو فقط یه روز اضافه کنین؟ بعد امتحانات به مسافرت رفته بودیم و نمیتونستم وارد بشم ، اطلاعیه هارو الان دیدم ، اگه امکانش هست ، لطفا فقط یه روز اینکارو انجام بدید ، و اینکه اگه قراره دوباره اینکارو کنین تو روبیکا یا با پیامک اطلاع رسانی کنید که دیگه جا نمونیم ... 😭"
12,"سلام وقتتون بخیر باشه ، یه سوال برای المپیک باید جایی ثبت نام کنیم؟لایو رو دیدم ولی میشه لطفا یه متن هم از المپیک تو کانال روبیکا بگذارید؟"
12,"سلام ، خیلی خیلی متشکرم"
12,"سلام وقت بخیر ، تو کانال روبیکای کیبرد نوشتید چالش تمدید شده ، ولی توی قسمت چالش ها تغییری اعمال نشده ، آیا پیام چنل درست است؟"
13,سلام روز بخیر
18,سلام لطف می کنید زمان ارسال تمرینات را چند روز افزایش دهید؟
18,سلام ببخشید هم اکنون ساعت ۲۳:۲۲ روز ۱۹ اردیبهشت است ولی تمرین دوم یخش پایتون(۲) برایم غیر فعال شده است در صورتی که تا ۳۷ دقیقه دیگر وقت دارم. لطفا آن را برایم باز کنید.
18,این نماگرفت آن است.
18,من هر کاری کردم نتوانستم ارسال کنم. با توجه به اینکه من قبل از اتمام مهلت تکلیف خود را ارسال کرده ام لطف کنید شما آن را بارگذاری کنید.
20,امتیاز ویدیو دوم برای من لحاظ نشده  ایا مشکلی پیش میاد لطفا اطلاع رسانی کنید
20,الان یه ویدیو دیگه ام دیدم همینطوری شد
20,ولی برای من لحاظ نشده
21,سلام وقت بخیر  ببخشید میشه لطفا مهلت ارسال تمرین جلسه سوم و چهارم را تمدید کنید به علت امتحانات نتونستم حل کنم 
21,ممنونم 
21,سلام 
21,وقت بخير لطفا مهلت ارسال تمرين را تمديد كنيد به علت ويروس جديد توانايي انجام انها فراهم  نيست 
21,ممنونم 
24,سلام من هر کار میکنم نمیتونم برم به سوالات پاسخ دهم  
24,چکار کنم
25,"سلام من به خاطر امتحانات چند جلسه رو نتونستم ببینم، الان که زمان ارسال تکالیف تموم شده، فیلم‌های بعدی و برام باز نمی‌کنه، چرا؟"
25,وقتی مهلت تموم شده امتیاز سوال‌هام ثبت نمی‌شه و به مرحله بعدی نمی‌رم
26,سلام خسته نباشید. ببخشید شما برای ارسال پاسخ تمرینات ویدیو های جلسه دوم و سوم تا تاریخ ۱۶ اردیبهشت وقت داده بودید اما الان گزینه ارسال پاسخ ها برای ما بسته شده.
28,"سلام خسته نباشید  ببخشید میشه یک لطفی کنید اموزش پایتون ۱ و ۲ زمان بیشتری بدید برای تکالیف، من دوازدهم هستم و نهایی نزدیکه واقعا فرصت نشده  لطفا یکم زمانهاشونو بیشتر کنید "
29,سلام من داشتم فیلم معرفی هوش مصنوعی قسمت 2 و کلان چالش ها و هوش مصنوعی قسمت 1 را می دیدم که وقتی سوال دوم را جواب دادم نگذاشت سوال سوم را جواب بدم و امتیاز را ثبت کرد اگه میشه سوال هارا دوباره فعال کنید 
29,میشه جواب بدید
31,ایجاد یک فضا برای پرسش و پاسخ با مدرسان  
31,ببخشید من تکالیف دو جلسه را جابجا فرستادم   مشکلی پیش نمیاد؟
32,سلام لطفا باتوجه به مغایرت زمان ارسال تمارین با امتحانات برای تمرینات تا تاریخ 16م وقت بیشتری لحاظ فرمایید .... 
32,با تشکر
32,سلام گفته شد که زمان ارسال تمارین تا 12 امشب خواهد بود بنده دقایقی قبل از پایان مهلت تلاش به ارسال تمرین کردم اما ارسال بسته شده بود . لطفا نسبت به تعیین زمان درستی اقدام فرمایید .  به دلیل نقص تایمر سایت امکان ارسال پاسخ محتوا سلب شد ..........
32,سلام بررسی کردید؟
32,سلام واقعا خیلی شروط نوشته شده در سایت ضعیفه من هنوز یک سوال رو جواب ندادم اما نوشته شده به محض پاسخ دادن به سوال سوم امکان پاسخگویی بسته بشه . خب الان این امتیازات ناحقی که کم میشه رو چیکار کنیم؟
32,سلام نمونه کار تولید شده مبارزه در کربلا توسط هوش مصنوعی
32,محمدطاها محمودی پایه 11 کرمانشاه
32,تصویر
32,سلام متشکرم
32,سلام وقت بخیر متاسفانه مشکلات سایت انتها ندارد . در فیلم جلسه چهارم از اخرین مجموعه اموزشی پایتون سوال اخر اصلا روی صفحه بالا نیامد و اجازه پاسخگویی داده نشد و نمره کم شد . لطفا زمان جایگزین اعلام بفرمایید که امکان پاسخگویی به این سوال برای بنده فراهم میشه وگرنه دیگر به دلیل نقایص بی انتها لزومی برای ادامه دوره نیست . باتشکر
32,پاسخ به سوال ..... درحال نزدیک شدن به اتمام آموزش عمومی هستیم و افراد برتر مورد تقدیر قرار می‌گیرند یا از کسانیکه تمارین رو به شیوه صحیح به انجام رسوندن قدردانی میشه ...
32,سلام علیکم
32,ممنونم از پیگیری شما . محبت فرمودید
32,با استفاده از مدل هوش مصنوعی Bing.com
32,سلام وقت بخیر  خواستم تشکر کنم بابت زحماتی که در این مدت کشیده شد . ممنونم از خدماتی که ارائه دادید .  ضمنا اجازه هست فیلم های آموزشی را دانلود کنم ؟ حق نشر رو هم رعایت میکنم فقط برای استفاده شخصی عرض میکنم
32,ممنونم اما خب خیلی علاقه به یادگیری این مطالب دارم . و سال اینده کنکور دارم متاسفانه مهلت استفاده ندارم . خواستم اجازه بگیرم که با رضایت همراه اول با افزونه دانلود کنم
32,متشکرم
37,سلام ببخشید میخواستم بدونم فایل پایتون رو که به صورت پی دی اف ارسال می کنیم باید خود برنامه ای که ساختیم در آن موجود باشد یا خیر؟ تشکر. 
37,دستتون درد نکنه.
39,سلام نمیتوانم تکالیف ارسال کنم لطفا راهنمایی بفرمایید 
42,ببخشید من نمیرسم تا اخر امشب تمام فیلم های پایتون رو ببینم نمیتونم بعد تکالیف رو ارسال کنم 
42,لطفا بزارید بعد بفرستم
43,سلام خسته نباشید چرا امتیاز تمازین هنوز برای من ثبت نشده؟
43,عذر میخوام الان جدول امتیازاتم رو دیدم و متوجه شدم. ولی من تمرین قسمت سه و چهار کلان چالش ها رو جا انداختم متاسفانه. میشه لطفا ارسال تمرین این دو قسمت رو باز کنید تا من الان بتونم امتیاز این دو قسمت هم دریافت کنم؟
43,چون من فایل تمرینات رو آماده دارم ولی متاسفانه نتوستم اونها رو اپلود کنم و جا انداختم.
44,سلام ویدیوی شماره ۳ رو نگاه کردم ولی ویدیوی شماره ۴ باز نمیشه. مشکل از چیه؟
45,سلام خسته نباشید من سوالات قسمت 4 رو دیر انجام دادم بعد گفتن ثبت نمیشه.بعد 2 روز بعد که اومدم داشتم یک بار دیگه آخر ویدیو رو نگاه میکردم ویدیو که تمام شد همه ی سوالات بدون پاسخ ثبت شد من باید چه کارکنم
46,سلام وقت بخير  ببخشيد برنامه vscodeبراىايفون دانلود نميشه  ميشه راهنمايى كنيد لطفا
46,ممنونم 
46,سلام 
46,روز بخیر 
46,ببخشید امکانش هست جواب درست تمرین ها و سوالات هر ویدیو رو در دسترس ما قرار بدهید لطفا چون من سوالات ویدیویی رو کاملا درست جواب دادم اما امتیاز نگرفتم 
46,ببخشید حل تمرین ها در اختیار ما قرار می‌گیرد اما استاد به طور کلی صحبت میکنن و مثلا همون تمرین رو به صورت عملی حل نمیکنن که ما درقسمت برنامه نویسی متوجه بشیم که چگونه عمل کنیم 
46,ممنونم
48,"با سلام مگر فرست ارسال تمارین ۳و ۴ تا آخر امشب نیست ؟ ولی در سایت بسته است در صورتی که در کانال گفتید تا آخر امروز ⭕️ اطلاعیه شماره 3:  با توجه به زمان امتحانات میان‌ترم و درخواست برخی دانش‌آموزان، مهلت ارسال تمرین جلسات اول و دوم، به مدت 2 روز و تا پایان روز سه‌شنبه 11 ام اردیبهشت ماه تمدید شد.  📌 جدول مهلت ارسال تمرین جلسات به شرح زیر خواهد بود:  🔸جلسه اول: 11 اردیبهشت 🔹جلسه دوم: 11 اردیبهشت 🔸جلسه سوم: 16 اردیبهشت 🔹جلسه چهارم: 16 اردیبهشت 🔸جلسه پنجم: 23 اردیبهشت  موفق باشید🌱  #اطلاعیه #مهلت_ارسال_تمرین"
48,ممنون
48,و حالا اگر امکان داره یه یک رو ز مهلت بدهید خیلی خیلی ممنون میشم
48,با تشکر از زحمات فروان شما
51,سلام وقت بخیر من موفق به نصب پایتون روی کامپیوتر نشدم. اگه میشه راهنمایی کنید 
51,یعنی کامپیوتر خونه ما این برنامه رو قبول نمیکنه
52,لطفا زمان ارسال تکالیف رو بزارید بعد از امتحانات نهایی درس های مدرسه زیاد هست وقت کم میاریم با تشکر .
56,"سلام ، الان امکان امکان پاسخ به سوالات جلسات اولیه وجود ندارد و برای دیدن قسمت بعد باید به سوالات قسمت قبل جواب داد"
56,سلام گفته بودید برای اینترنت شماره ارسال کنم 09112077351
58,سلام خسته نباشید ببخشید امروز توی شاد بازم جلسه جدید آموزشی گذاشتم برای ما این جلسات گذشته  باز نمی‌شه که ما حل کنیم تمرین بفرستیم و نمی‌دونیم باید چیکار کنیم الان اون افرادی که با ما هستند نمراتشونو گرفتن و ما ولی ما نمرات اون دوره رو نداریم دوره ها هنوز زمان دارد اونا هم باز نمیشه میگه دوره های قبل را باید پرکنید 
58,سلام ببخشید من هرچی تمرین میفرستم 3 نمره میده ولی من نه فایل رو ویرایش میکنم نه کار دیگه ای و فایل هایی که میفرستم هم کاملن لطفا پیگیری کنید  و همچننین لطفا تمرینات هر فایل تمرینی رو کمتر کنید در یک فایل تمرین 5 تمرین گذاشته میشه که باید کد نویسی کرد 
58,سلام ببخشید من نمیتونم تمرینات بعد از پایتون 4 قسمت 3 رو بفرستم 
59,با سلام بعد از انتخاب جواب سوال بعد از چند دقیقه خودش پاک میکنه جوابو و آخر سر امتیاز رو کم میکنه.
59,"با سلام بنده درخواستی مبنی بر اجازه انجام دوباره مرحله پایتون یک قسمت سوم رو دا ه بودم که برام صفر لحاظ شده بود بخاطر خارج شدن از گوگل ، نتیجه چی شد؟"
61,سلام وقت بخیر من توی کانال شاد عضو هستم و گفته بودن ک جلسه ۳ و ۴ را تا ۱۶ ام میتونیم تمرین هاش رو بفرستیم در صورتی ک سایت زود تر بسته شده لطفا پیگری کنید
61,بله ممنون
61,سلام 
61,حدودا از وقتی ک کلیپ های حل تمارین رو گذاشتید سایت مشکل پیدا کرده و بالا و پایین نمیشه و دسترسی بهش ندارم 
61,چیکار باید انجام بدم تا درست بشه 
61,با عکس نمیشه درست گفت منظورم اینه ک وقتی میخوام فایل های پایین تری رو ببینم با اینکه صفحه رو با انگشت میبرمش بالا ولی صفحه تغییری نمیکنه و حرکت نمیکنه و دسترسی ب فایل های پایین تر ندارم
61,با عکس نمیشه درست گفت منظورم اینه ک وقتی میخوام فایل های پایین تری رو ببینم با اینکه صفحه رو با انگشت میبرمش بالا ولی صفحه تغییری نمیکنه و حرکت نمیکنه و دسترسی ب فایل های پایین تر ندارم
61,با عکس نمیشه درست گفت منظورم اینه ک وقتی میخوام فایل های پایین تری رو ببینم با اینکه صفحه رو با انگشت میبرمش بالا ولی صفحه تغییری نمیکنه و حرکت نمیکنه و دسترسی ب فایل های پایین تر ندارم
61,مدل گوشی ام هم شیائومی پرو نوت ۸ هست
61,سلام
61,من اومدم یکی از کلیپ ها رو زدم اخر ک ببینم تکلیف به چه صورته برام نوشت امتیاز سوالات ۰ از ۶ درصورتی ک من فقط یه لحظه زدم اخر ک تکلیف رو ببینم
61,لطفا پیگیری کنید ک بتونم این امتیاز رو بدست بیارم
61,الان هم دوباره به همین صورت شد دستم خورد اخر ویدیو و بدون اینکه سوالات رو دیده باشم یا حتی ۰واب داده باشم نمره صفر ثبت شد
61,این باگ برای کلیپ ها هستش و بدون اینکه ما حتی جواب داشته باشیم یا هرچیز دیگری دستمون ک میخوره اخرش سوالات رو ۰ رد میکنه
61,شما این تصویر رو ببنید به این صورت شده حتی با اینکه من سوالات رو جواب ندادم
61,تشکر الان درست شده بود
62,ببخشید من به دوتا از سوالات برنامه نویسی پایتون دو جلسه دوم جواب درست را دادم ولی امتیازم صفر شد 
62,نمیتونم تمرین ها رو ارسال کنم امروز آخرین روزه لطفا پیگیری کنین یا وقت بدین
62,درمورد خبر خوبی که گفتین قرار بخش چالش ها شروع بشه؟؟
62,ممنون
63,سلام وقت بخیر اگر می شود برای تمرین ها قسمت دوم آموزش پایتون وقت را زیاد کنید چون امتحانات ما شروع شدن و وقت کافی نداریم
64,لطفا وقت ارسال تمرین ها رو زیاد تر کنید چون امتحانات شروع شده و وقتی نیست که ویدیو ها رو ببینیم 
65,سلام وقت بخیر میخواستم بگم اگه میشه مهلت ارسال تمرین را برای جلسات سوم و چهارم بیشتر کنید چون امتحانات شروع شده و واقعا فرصت نمیکنیم ویدیوهارا ببینیم ممنون میشم اگه فرصت رو بیشتر کنید
65,"سلام وقت بخیر  ببخشید یک مشکلی در پخش ویدیو ها وجود دارد مشکل اینه که که در حین پخش ویدیو اگر صفحه را از حالت کوچک ، بزرگ کنیم یا برعکس، از حالت بزرگ کوچک کنیم، ویدیو دوباره از اول شروع میشود و این ایراد بدیه چون ممکنه بخوایم تا یه قسمتی از ویدیو رو مشاهده کنیم و مثلا لپ تاب را خاموش کنیم و بعدا ادامه ان را ببینیم ، ولی با وجود این مشکل چنین کاری امکان پذیر نیست چون دوباره ویدیو  از اول شروع میشه و نمیدونیم دفعه قبل تا کجارا مشاهده کردیم، که ادامش رو ببینیم ممنون میشم این مشکل رو حل کنید باتشکر"
65,سلام وقت بخیر 
65,به نظر من خبر خوبتون میتونه برگزاری یک برنامه حضوری در شرکت همراه اول باشه
65,سلام وقت بخیر 
65,"چرا بعد از زدن گزینه حل تمرین ، یک صفحه با عنوان ورود کاربر باز میشه؟"
65,"با ورود به ویدیوی موردنظر ، بعد از اینکه ویدیو رو دیدم میخواستم ویدیوی حل تمرین را ببینیم و روی گزینه حل تمرین پایین ویدیو زدم که این صفحه بازشد"
65,این هم ویدیوش
65,متشکرم
66,سلام روز بخیر ببخشید میخواستم ببینم امکان تمدید تکالیف هست؟ چون نزدیک امتحانات نهایی هست خیلی سخته  من فکردم مهلت تا اخر امشب هست الان دیدم مهلت تموم شده لطفا تمدید کنین  فایل تکالیف هم ضمیمه کردم.
66,تمرین 0201
66,تمرین 0202
66,ممنون میشم نمره من رو لحاظ کنید
66,من الان چک کردم گفته بودین تا پایان روز 16 اردیبهشت مهلت دارن ولی وقتی فایل میفرستم میگه مهلتش تموم شده
66,تمرین 0203
66,تمرین 0204
69,با عرض سلام و خسته نباشید می خواستم اگه میشود تایم دیدن فیلم ها را (قسمت های پایتون) را تمدید کنید به دلیل اینکه امتحان ها شروع شده و حداقل ما سه نوع امتحان داریم(نهایی ورودی مرات) و این خیلی وقتی برای ما باقی نمی گزاره تا فیلم ها رو ببینیم همیچنین در خواست داشتم این قانون رو بردارد.....
72,"سلام وقتتون بخیر، بخش کلان چالش ها و هوش مصنوعی 1 رو من انجام دادم و ثبت کردم اما ثبت نشده و بخش کلان چالش ها و هوش مصنوعی 2 برای من بسته هست و من میخوام اون کلیپ ها رو داشته باشم، اما چون مهلت ارسال سوال تمام شده من نمیتونم مجدد بخش کلان چالش ها و هوش مصنوعی 1 رو انجام بدم تا بخش دوم باز بشه، میشه بخش دوم رو باز کنید؟ هرچند که من قبلا اعتراض زده بودم که جواب های من توی این دو بخش ثبت نشده و شاید به همین دلیل بسته بودند مه من دوباره برم اما متاد دیر شده بود و من روز 15 ام دیدم و متاسفانه بسته شده بود..."
72,درست شد الان! اونموقع من سوالارو جواب داده بودم اخطار پایان مهلت زد و قبول نکرد 
72,ممنون از پاسخگوییتون
72,"ببخشید یه مشکلی هست که وقتی از صفحه کامل میایی بیرون ویدیو کامل از بین میره و از اول باید شروع به دیدن فیلم کنی، اگر بشه این باگ رو رفع کرد خیلی خوب میشه خیلی ممنون بابت اینکه جای سوالا رو نشون میدین"
72,"سلام وقتتون بخیر، من به همه ی سوالات پایتون 3 قسمت 1 جواب دادم ولی هیچکدوم برام ثبت نشده، چرا؟"
72, میشه یک بار دیگه اجازه بدین به سوالا جواب بدم؟ چون این باگ خیلی ناراحت کننده هست! من به همه سوالا جواب دادم ولی هیچکدوم رو ثبت نکرد(یهو از صفحه پرید بیرون و بعدش که برگشتم گفت امتیاز شما 0 از 6!)
